{
  "schema_version": "1.0.0",
  "kind": "agent_handoff",
  "handoff_id": "e457a6b7-eab1-4b56-9fd4-3e31094d7f1d",
  "task_id": "task_6",
  "attempt_id": "attempt-6-09-review-a1",
  "created_at": "2026-09-28T15:15:00Z",
  "producer": {
    "harness": "codex",
    "agent_id": "reviewer",
    "session_id": null
  },
  "recipient": {
    "harness": "codex",
    "agent_id": "orchestrator",
    "session_id": null
  },
  "outcome": "completed",
  "objective": "Final technical acceptance review of TASK-6-07 and current QA evidence for SPEC-6 revision 1.",
  "requested_response": "Approve/reject with findings, reviewed scope, evidence consumed, and residual risks.",
  "constraints": [
    "Review was read-only; no files, staging, commits, branches, remotes, cleanup, or QA runs were performed."
  ],
  "evidence": [
    {"id": "REVIEW-6-02", "kind": "observation", "reference": "Approve. REVIEW-6-01 is resolved; explicit catalog reaches CLI validate/suite-run/prepare/smoke and adapter materialization. Omitted catalogs remain empty and fail closed. No implicit Core lookup was found."},
    {"id": "REVIEW-6-02-SCOPE", "kind": "observation", "reference": "Reviewed combined diff SHA-256 44f1bc89cc38d8297be0ad2f6f9f199b5607203ae4beac97d0dbfaa292527dcf over HEAD 7df5475cf51d7ed1ed81685e280f6e60016f0a61. No blocking findings."},
    {"id": "QA-6-08", "kind": "artifact", "reference": "docs/harness-history/task_6/return-task-6-08-qa-a1.json"},
    {"id": "REVIEW-6-01", "kind": "artifact", "reference": "docs/harness-history/task_6/return-task-6-06-review-a1.json"}
  ],
  "changed_paths": [],
  "validation": [],
  "commit_status": "not_applicable",
  "commit_reason": "Final review is read-only and owns no implementation commit.",
  "git_commits": [],
  "artifacts": []
}
