{
  "schema_version": "1.0.0",
  "kind": "agent_handoff",
  "handoff_id": "06cb77f5-79a9-4fc5-909c-d521f1cb5d4c",
  "task_id": "task_6",
  "attempt_id": "attempt-6-05-qa-a2",
  "created_at": "2026-09-28T14:39:14Z",
  "producer": {
    "harness": "codex",
    "agent_id": "quality-assurance",
    "session_id": null
  },
  "recipient": {
    "harness": "codex",
    "agent_id": "orchestrator",
    "session_id": null
  },
  "outcome": "completed",
  "objective": "Independently retest AC-6-2 and AC-6-7 after the Harness Factory explicit-catalog correction.",
  "requested_response": "Return exact targeted test outcomes, verify catalog propagation and no implicit Core lookup, and identify any reproduced defect.",
  "constraints": [
    "QA was read-only and ran against HEAD 7df5475cf51d7ed1ed81685e280f6e60016f0a61 plus diff sha256 c81f9bc27ac9e07184906857ae01c1b97d3afbd170815406de035ead1f0d6c2d.",
    "The original QA failure remains preserved in return-task-6-05-qa-a1.json; this retest applies only to the affected criteria.",
    "Reviewer remains the final technical acceptance owner."
  ],
  "evidence": [
    {"id": "QA-6-05-A2-AC2", "kind": "command", "reference": "test_harness_factory.py: 29 passed; explicit catalog reaches validation and materialization."},
    {"id": "QA-6-05-A2-AC7", "kind": "command", "reference": "test_expertise_framework.py: 39 passed; Pack v1 behavior remains valid."},
    {"id": "QA-6-05-A2-CATALOG", "kind": "observation", "reference": "Empty or omitted catalog rejects researcher as unknown; no Core catalog lookup was found in Harness Factory or generic Expertise validation."},
    {"id": "IMPLEMENTATION-DIFF-6-02-A2", "kind": "observation", "reference": "Verified exact worktree patch sha256 c81f9bc27ac9e07184906857ae01c1b97d3afbd170815406de035ead1f0d6c2d."}
  ],
  "changed_paths": [],
  "validation": [
    {"check": "AC-6-2 explicit catalog validation/materialization", "result": "passed", "observed_at": "2026-09-28T14:39:14Z", "subject": "TASK-6-02-A2", "command": "PYTHONDONTWRITEBYTECODE=1 TMPDIR=/var/tmp/agentic-workflow-plugin-factory-decoupling/tmp uv run --no-project --with pyyaml --with typer python -m unittest discover -s tests -p 'test_harness_factory.py'"},
    {"check": "AC-6-7 Expertise Pack v1 behavior", "result": "passed", "observed_at": "2026-09-28T14:39:14Z", "subject": "TASK-6-02-A2", "command": "PYTHONDONTWRITEBYTECODE=1 TMPDIR=/var/tmp/agentic-workflow-plugin-factory-decoupling/tmp uv run --no-project --with pyyaml --with typer python -m unittest discover -s tests -p 'test_expertise_framework.py'"}
  ],
  "commit_status": "not_applicable",
  "commit_reason": "Independent QA produced no code commit.",
  "git_commits": [],
  "artifacts": []
}
