{
  "schema_version": "1.0.0",
  "kind": "agent_handoff",
  "task_id": "task_6",
  "created_at": "2026-09-28T12:28:36Z",
  "producer": {
    "harness": "codex",
    "agent_id": "implementer",
    "session_id": null
  },
  "recipient": {
    "harness": "codex",
    "agent_id": "orchestrator",
    "session_id": null
  },
  "constraints": [],
  "commit_status": "not_created",
  "commit_reason": "The Orchestrator owns integration, assurance, and the focused task commit.",
  "git_commits": [],
  "artifacts": [],
  "handoff_id": "c0c576f7-d67a-4af9-aee1-99fdbe44a523",
  "attempt_id": "attempt-6-01-a1",
  "outcome": "completed",
  "objective": "Record Implementer completion for TASK-6-01.",
  "requested_response": "Persist exact changed paths, projection behavior, validation, Pack v1 evidence, and residual risks.",
  "evidence": [
    {
      "id": "SPEC-6",
      "kind": "artifact",
      "reference": "todos/in_progress/2026-09-28/plugin-factory-decoupling.md"
    },
    {
      "id": "PLAN-6",
      "kind": "artifact",
      "reference": "docs/planner-history/task_6/plan-r1.md"
    },
    {
      "id": "VALIDATION-6-01",
      "kind": "observation",
      "reference": "Implementer return plus Orchestrator reruns recorded in the TASK-6-01 implementation evidence."
    }
  ],
  "changed_paths": [
    "agentic-core/agents/architect.md",
    "agentic-core/agents/challenger.md",
    "agentic-core/agents/devops.md",
    "agentic-core/agents/implementer.md",
    "agentic-core/agents/orchestrator.md",
    "agentic-core/agents/planner.md",
    "agentic-core/agents/projection-losses.json",
    "agentic-core/agents/projections.json",
    "agentic-core/agents/quality-assurance.md",
    "agentic-core/agents/researcher.md",
    "agentic-core/agents/reviewer.md",
    "agentic-core/com.github.copilot/agents/architect.agent.md",
    "agentic-core/com.github.copilot/agents/challenger.agent.md",
    "agentic-core/com.github.copilot/agents/devops.agent.md",
    "agentic-core/com.github.copilot/agents/implementer.agent.md",
    "agentic-core/com.github.copilot/agents/orchestrator.agent.md",
    "agentic-core/com.github.copilot/agents/planner.agent.md",
    "agentic-core/com.github.copilot/agents/quality-assurance.agent.md",
    "agentic-core/com.github.copilot/agents/researcher.agent.md",
    "agentic-core/com.github.copilot/agents/reviewer.agent.md",
    "agentic-core/core_agents.py",
    "expertise/targets/antigravity_plugin.py",
    "expertise/targets/codex.py",
    "scripts/install_codex_agents.py",
    "scripts/project_core_agents.py",
    "tests/test_agentic_core_sources.py",
    "tests/test_antigravity_plugin_projection.py"
  ],
  "validation": [
    {
      "check": "test_agentic_core_sources.py",
      "result": "passed",
      "observed_at": "2026-09-28T12:28:36Z",
      "subject": "TASK-6-01",
      "command": "uv run --no-project --with pyyaml --with typer python -m unittest discover -s tests -p 'test_agentic_core_sources.py'"
    },
    {
      "check": "test_antigravity_plugin_projection.py",
      "result": "passed",
      "observed_at": "2026-09-28T12:28:36Z",
      "subject": "TASK-6-01",
      "command": "uv run --no-project --with pyyaml --with typer python -m unittest discover -s tests -p 'test_antigravity_plugin_projection.py'"
    },
    {
      "check": "test_expertise_framework.py",
      "result": "passed",
      "observed_at": "2026-09-28T12:28:36Z",
      "subject": "TASK-6-01",
      "command": "uv run --no-project --with pyyaml --with typer python -m unittest discover -s tests -p 'test_expertise_framework.py'"
    },
    {
      "check": "test_pluginctl_lifecycle.py",
      "result": "passed",
      "observed_at": "2026-09-28T12:28:36Z",
      "subject": "TASK-6-01",
      "command": "uv run --no-project --with pyyaml --with typer python -m unittest discover -s tests -p 'test_pluginctl_lifecycle.py'"
    },
    {
      "check": "Ruff and whitespace",
      "result": "passed",
      "observed_at": "2026-09-28T12:28:36Z",
      "subject": "TASK-6-01",
      "command": "Ruff check; Ruff format --check; git diff --check"
    },
    {
      "check": "projection checks",
      "result": "passed",
      "observed_at": "2026-09-28T12:28:36Z",
      "subject": "TASK-6-01",
      "command": "scripts/project_core_agents.py --check; isolated Codex installation --check; Antigravity projection; agy plugin validate"
    }
  ]
}
