{
  "schema_version": "1.0.0",
  "kind": "agent_handoff",
  "handoff_id": "25d8cbf9-3929-4c27-8bf2-82f6901f9aa7",
  "task_id": "task_6",
  "attempt_id": "attempt-6-04-a1",
  "created_at": "2026-09-28T13:10:00Z",
  "producer": {
    "harness": "codex",
    "agent_id": "orchestrator",
    "session_id": null
  },
  "recipient": {
    "harness": "codex",
    "agent_id": "implementer",
    "session_id": null
  },
  "outcome": "ready",
  "objective": "Implement TASK-6-04: project the shared agent-policy prefix of AGENTS.md deterministically into .github/copilot-instructions.md, ending at the unique closing </risk_assessment> marker.",
  "requested_response": "Return changed paths, generator behavior, exact validation commands/results, and any output drift. Keep .github/copilot-instructions.md unchanged if generated bytes already match. Do not stage or commit.",
  "constraints": [
    "TASK-6-04 depends only on completed TASK-6-01; it may proceed independently of TASK-6-02 and TASK-6-03.",
    "Treat AGENTS.md as the canonical source. Find exactly one line-aligned </risk_assessment> marker; do not depend on a fixed line count.",
    "Preserve source bytes through the marker, including the trailing newline, and exclude all later sections such as Git workflow.",
    "Add a small generator with a --check mode and a focused positive test for repeatability and equality with the checked-in projection.",
    "Do not modify AGENTS.md or unrelated .github files. Do not alter the checked-in projection if it already matches.",
    "Use uv for Python execution and Ruff for lint/format checks. Preserve all unrelated worktree changes. Do not stage or commit."
  ],
  "evidence": [
    {"id": "SPEC-6", "kind": "artifact", "reference": "todos/in_progress/2026-09-28/plugin-factory-decoupling.md"},
    {"id": "PLAN-6", "kind": "artifact", "reference": "docs/planner-history/task_6/plan-r1.md"},
    {"id": "TASK-6-01", "kind": "observation", "reference": "Neutral source and three projections are complete and validated."},
    {"id": "PROJECTION-BASELINE-6-04", "kind": "observation", "reference": ".github/copilot-instructions.md currently matches the first 35 lines of AGENTS.md through the unique </risk_assessment> marker."}
  ],
  "changed_paths": [],
  "validation": [],
  "commit_status": "not_created",
  "commit_reason": "The Orchestrator owns staging and commits after implementation, independent QA, and Reviewer gates.",
  "git_commits": [],
  "artifacts": []
}
